{
  "schemaVersion": 1,
  "generatedFrom": [
    "js/data.js"
  ],
  "generatedAt": "2026-03-14T22:40:35.281Z",
  "albums": [
    {
      "id": "wings-of-fire",
      "title": "Wings of Fire",
      "artist": "Triad of Angels",
      "genre": "Female Group, Cinematic Pop, Orchestral, Ballad",
      "year": "May, 2025",
      "cover": "assets/images/albums/wingsoffire-album.webp",
      "tracks": [
        "Awakening the Triad",
        "Wings of Fire",
        "We are the Triad",
        "Starlight Wounds",
        "Ascension Hearts",
        "Halo in the Storm"
      ],
      "links": {
        "spotify": "https://open.spotify.com/album/4K83YJEeETmcybKtQ1LP5l?si=fOFELopLS9W3eLOSR8x5tA",
        "appleMusic": "https://music.apple.com/us/album/wings-of-fire-ep/1812163266",
        "youTubeMusic": "https://music.youtube.com/playlist?list=OLAK5uy_kpbLV2nL-Ryt_nKkJ8CFfll701Zrw9N6k&si=c0d1GLRChrOKtkbK"
      },
      "artistInfo": "A clear entry point into Triad of Angels: cinematic pop, strong melodies, and the first shape of the trio’s emotional world.",
      "lyrics": {
        "awakening-the-triad": {
          "file": "",
          "duration": "",
          "story": "",
          "video": null,
          "behindTheScenes": "",
          "links": {},
          "musicPlayerId": "",
          "text": "",
          "description": ""
        },
        "wings-of-fire": {
          "file": "",
          "duration": "",
          "story": "",
          "video": null,
          "behindTheScenes": "",
          "links": {},
          "musicPlayerId": "",
          "text": "",
          "description": ""
        },
        "we-are-the-triad": {
          "file": "",
          "duration": "",
          "story": "",
          "video": null,
          "behindTheScenes": "",
          "links": {},
          "musicPlayerId": "",
          "text": "",
          "description": ""
        },
        "starlight-wounds": {
          "file": "",
          "duration": "",
          "story": "",
          "video": null,
          "behindTheScenes": "",
          "links": {},
          "musicPlayerId": "",
          "text": "",
          "description": ""
        },
        "ascension-hearts": {
          "file": "",
          "duration": "",
          "story": "",
          "video": null,
          "behindTheScenes": "",
          "links": {},
          "musicPlayerId": "",
          "text": "",
          "description": ""
        },
        "halo-in-the-storm": {
          "file": "",
          "duration": "",
          "story": "",
          "video": null,
          "behindTheScenes": "",
          "links": {},
          "musicPlayerId": "",
          "text": "",
          "description": ""
        }
      },
      "releaseDate": "",
      "description": "A clear entry point into Triad of Angels: cinematic pop, strong melodies, and the first shape of the trio’s emotional world.",
      "artistDescription": "",
      "tags": []
    },
    {
      "id": "ascend",
      "title": "Ascend",
      "artist": "Triad of Angels",
      "genre": "Female Group, Cinematic Pop, Orchestral, Alternative, Soundtrack",
      "year": "May, 2025",
      "cover": "assets/images/albums/ascend-album.webp",
      "tracks": [
        "Ascend",
        "Fireproof",
        "We Are Light",
        "Echoes of Hope",
        "Rising Tide",
        "Hold the Sky",
        "Home to My Heart",
        "Unseen Wings",
        "Breathe",
        "Into the Light"
      ],
      "links": {
        "spotify": "https://open.spotify.com/album/5EetoHOZzPFoLGfM7XzTim?si=cWzTT5jKQ5KI-KkQYubADQ",
        "appleMusic": "https://music.apple.com/us/album/ascend/1812603057",
        "youTubeMusic": "https://music.youtube.com/playlist?list=OLAK5uy_n6axY2s6JOnfyXOqSsWQ9o1Rmz05azC4w&si=5HJAAMnu0iXVlpNb"
      },
      "artistInfo": "Ascend leans further into lift, motion, and atmosphere, carrying Triad of Angels through a more expansive cinematic-pop frame.",
      "lyrics": {
        "ascend": {
          "file": "",
          "duration": "",
          "story": "",
          "video": null,
          "behindTheScenes": "",
          "links": {},
          "musicPlayerId": "",
          "text": "",
          "description": ""
        },
        "fireproof": {
          "file": "",
          "duration": "",
          "story": "",
          "video": null,
          "behindTheScenes": "",
          "links": {},
          "musicPlayerId": "",
          "text": "",
          "description": ""
        },
        "we-are-light": {
          "file": "",
          "duration": "",
          "story": "",
          "video": null,
          "behindTheScenes": "",
          "links": {},
          "musicPlayerId": "",
          "text": "",
          "description": ""
        },
        "echoes-of-hope": {
          "file": "",
          "duration": "",
          "story": "",
          "video": null,
          "behindTheScenes": "",
          "links": {},
          "musicPlayerId": "",
          "text": "",
          "description": ""
        },
        "rising-tide": {
          "file": "",
          "duration": "",
          "story": "",
          "video": null,
          "behindTheScenes": "",
          "links": {},
          "musicPlayerId": "",
          "text": "",
          "description": ""
        },
        "hold-the-sky": {
          "file": "",
          "duration": "",
          "story": "",
          "video": null,
          "behindTheScenes": "",
          "links": {},
          "musicPlayerId": "",
          "text": "",
          "description": ""
        },
        "home-to-my-heart": {
          "file": "",
          "duration": "",
          "story": "",
          "video": null,
          "behindTheScenes": "",
          "links": {},
          "musicPlayerId": "",
          "text": "",
          "description": ""
        },
        "unseen-wings": {
          "file": "",
          "duration": "",
          "story": "",
          "video": null,
          "behindTheScenes": "",
          "links": {},
          "musicPlayerId": "",
          "text": "",
          "description": ""
        },
        "breathe": {
          "file": "",
          "duration": "",
          "story": "",
          "video": null,
          "behindTheScenes": "",
          "links": {},
          "musicPlayerId": "",
          "text": "",
          "description": ""
        },
        "into-the-light": {
          "file": "",
          "duration": "",
          "story": "",
          "video": null,
          "behindTheScenes": "",
          "links": {},
          "musicPlayerId": "",
          "text": "",
          "description": ""
        }
      },
      "releaseDate": "",
      "description": "Ascend leans further into lift, motion, and atmosphere, carrying Triad of Angels through a more expansive cinematic-pop frame.",
      "artistDescription": "",
      "tags": []
    },
    {
      "id": "celestia-the-light-within",
      "title": "Celestia: The Light Within",
      "artist": "Triad of Angels",
      "genre": "Cinematic, Pop, Ballads, Dance, Alternative",
      "year": "28th of May, 2025",
      "cover": "assets/images/albums/celestia-the-light-within-album.webp",
      "tracks": [
        "Aurora Rising",
        "Wings of Grace",
        "Echoes of Eternity",
        "Elysian Groove",
        "Sacred Ground",
        "Soulkeeper",
        "Cosmic Boots",
        "Celestial Dance",
        "Harmony’s Call",
        "Mirror of the Soul",
        "Hearts Made of Fire",
        "Halo Burn",
        "Through the Flame I Am",
        "Celestia The Light Within"
      ],
      "links": {
        "spotify": "https://open.spotify.com/album/567eYko6C0VuGXKq4myvIC?si=pvGKdX-UQAa9q-XOwvpqkQ",
        "appleMusic": "https://music.apple.com/us/artist/triad-of-angels/1811109753",
        "youTubeMusic": "https://music.youtube.com/playlist?list=OLAK5uy_kj2xaQyIOlhLxcXxpBy4nzhUXhrWaUlic&si=UGXcIqtMu7Xwypm0"
      },
      "artistInfo": "Celestia: The Light Within keeps the trio in a brighter, more reflective lane, balancing lift, devotion, and melodic drama.",
      "lyrics": {
        "aurora-rising": {
          "file": "",
          "duration": "",
          "story": "",
          "video": null,
          "behindTheScenes": "",
          "links": {},
          "musicPlayerId": "",
          "text": "",
          "description": ""
        },
        "wings-of-grace": {
          "file": "",
          "duration": "",
          "story": "",
          "video": null,
          "behindTheScenes": "",
          "links": {},
          "musicPlayerId": "",
          "text": "",
          "description": ""
        },
        "echoes-of-eternity": {
          "file": "",
          "duration": "",
          "story": "",
          "video": null,
          "behindTheScenes": "",
          "links": {},
          "musicPlayerId": "",
          "text": "",
          "description": ""
        },
        "elysian-groove": {
          "file": "",
          "duration": "",
          "story": "",
          "video": null,
          "behindTheScenes": "",
          "links": {},
          "musicPlayerId": "",
          "text": "",
          "description": ""
        },
        "sacred-ground": {
          "file": "",
          "duration": "",
          "story": "",
          "video": null,
          "behindTheScenes": "",
          "links": {},
          "musicPlayerId": "",
          "text": "",
          "description": ""
        },
        "soulkeeper": {
          "file": "",
          "duration": "",
          "story": "",
          "video": null,
          "behindTheScenes": "",
          "links": {},
          "musicPlayerId": "",
          "text": "",
          "description": ""
        },
        "cosmic-boots": {
          "file": "",
          "duration": "",
          "story": "",
          "video": null,
          "behindTheScenes": "",
          "links": {},
          "musicPlayerId": "",
          "text": "",